ID,User,DateCreated,Text
e4xp6oi;_3li_;1535429622.0;"The average American has a 401k. It means nothing to a majority of Democrats, who don't work and thus aren't involved in the economy at all. But those of us riding this stock market are making amazing returns the past year and a half or so. Im up 45% since Trump took office, compared to 29% over the 8 years the last guy was in office. "
e4xj3dt;mar3ware;1535424495.0;"Exactly where is that money going to come from? Thats why some people see it as a positive for the United States. If labor cost in Mexico increase there is less of an incentive to manufacture cars there. "
e4xhj8k;urriola35;1535423038.0;"Probably Mexico"
e4yifhj;Herbivore4Life;1535459376.0;"Apparently opening a dialogue with one of the most reclusive and dangerous countries in the world is "trouble.""
e4xtalz;praxtology;1535433020.0;"You are projecting something I'm not saying. The North Korea deal did not deliver the promise of denuclearzation. Details mattered.So, it is, in trade deals that details, not press conferences, matter. If that is anti-Trump, since you state I'm going to respond with a "snarky anti-Trump comment," it is because you believe details are anti-Trump. I'll risk that."
e4xu88i;tomorrowthesun;1535433845.0;"Not to get this further off topic, but do you have a source on the reactor dismantling?  Everything I've seen is that they started up a reactor not shut one down.  Or what benchmarks have they made?  If that's true I will revise my current poor view of the NK situation.  Don't like the way it was handled but any results out of NK is a good thing."
e4ynrbx;Neurorational;1535468252.0;"> Since talks about meeting began we’ve had nuclear reactors dismantledWhat reactors have been dismantled?"
e4z9iif;Praxis_Parazero;1535499212.0;"> Since talks about meeting began we’ve had nuclear reactors dismantledYou mean the testing facility that was already destroyed by an earthquake before the talks even happened?"
DELETED;NoAuthor;-1;DELETED;
DELETED;NoAuthor;-1;DELETED;
e4xpm9f;Vulnox;1535429976.0;"It is if the results aren’t going to persist as I said right after that.  Investing doesn’t mean pumping and dumping. "
e4xz3pl;godhand1942;1535438545.0;"This is poor form on your part and detracts from a good conversation. Stocks are only one form of investments. S&P and Dow shooting through the roof with an unsound foundation could be incredibly bad as that is simply speculation. Ask turkey how important public institutions are to their investments. We are in r/investing not r/cryptocurrency"
e4xvagt;Vulnox;1535434797.0;"*Temporary through 2020, corporate were permanent, doesn’t change that they didn’t have a good way to pay for it and long term that will hurt more than a short term 4% break.  I say that as someone that benefited quite a bit from that break, but still know it’s bad in the end with no plan to pay for it that doesn’t borrow from the future, which is normally fine as long as long term benefits outweigh the up front debt. Not good investment strategy, not good fiscal strategy. "
e4y0y41;NotAnNSAOperative;1535440420.0;"How does your response having anything to do with the comment you are replying to?  Its almost as if you ignored everything the user said. "
e4xq3y2;Zymyrgist;1535430376.0;"Fair enough. I worded that inaccurately.Did you just say the leaders of the countries don't have to be on the same page of a trade agreement? So they just sign it? No understanding necessary? "
e4xpgdf;Zymyrgist;1535429841.0;"Did you just say that a majority of Democrats don't work? Wow. And I thought my statement was vague and obnoxiously general. "
e4xxsyi;IsYesterdayEvenReal;1535437250.0;"Those are good returns recent times. How's your alpha been in Trump market's vs the previous administration? I know it's a different time-frame between the two, but just curious."
e4xk53w;Nick357;1535425421.0;"So car prices go up but the middle class is slightly expanded? Sounds alright."
e4xqdyu;TheGursh;1535430611.0;"Definitely not. We do specialized manufacturing that the Mexican plants are not trained for and they do not have a surplus of educated labour to be trained to do the work. We've also invested billions in infrastructure that doesn't exist in Mexico. So billions in training a labour force, capable labourers and billions more in infrastructure. The US deal also makes it less likely that US companies would move more of their operations to Mexico."
e4yyhce;unemployedITWorkerDB;1535488400.0;"I don't know. I haven't followed the news much since the economy crashed following President Trump's election "
e4xtfl6;best_damn_milkshake;1535433142.0;"Where are your details? You’re making a vague prediction that no trade details will emerge on the very same day a deal was announced. You’re jumping the gun "
e4y3au7;best_damn_milkshake;1535442865.0;"Dismantling:  https://www.google.com/amp/s/www.washingtonpost.com/amphtml/news/worldviews/wp/2018/07/23/north-korea-begins-dismantling-key-test-site-satellite-imagery-suggests/Again I’d like to make the point to avoid editorial and simply look at actions when it comes to news regarding anything having to do with Trump policy. The important action here is that satellite imagery suggests they’re dismantling a site which is used to produce liquid fuel engines. This sentence I think makes my point about editorial perfectly “If the analysis of the satellite imagery is accurate, North Korea may be taking a small but significant step toward the disarmament that was agreed upon by North Korean leader Kim Jong Un and President Trump during a landmark meeting in Singapore on June 12.” How can a step be both “small” and “significant”? It’s literally an oxymoron but the writer slipped the word small in there to put a negative light on this “significant” action being taken by NK"
e4zc34h;best_damn_milkshake;1535501435.0;"I’ve linked to several steps NK has taken towards the path of disarmament in this thread. Again, I said relations are better with NK than they’ve been in decades and we are clearly making slow but steady progress, as is expected. In fact I specifically said not even the strongest trump supporter thought it would happen over night. You’re made up deadlines, doomsday scenarios, and bleak outlook run counter to reality "
e4xyd0b;Ferelar;1535437801.0;"Also possible, though they had released 10 prisoners in the years leading up to the summit. In fact, two of the three remaining prisoners had been detained under Trump; so if your theory is true, it could even be that they figured Trump might be amenable to meeting and therefore detained someone so that they'd have people to release afterwards. Difficult to know what NK is thinking, I suppose. "
DELETED;NoAuthor;-1;DELETED;
e4xpztt;BimboDickins;1535430283.0;"USA, Mexico and Canada signing a great reciprocal deal will be persistent. It won't be a pump and dump. S&P going up is a symptom. What concern do you have when the deal is mutually beneficial?"
e4xz8jb;BimboDickins;1535438681.0;"Is everyone in here dyslectic today? I wrote it in the context of the deal being great which means the shooting up has a great foundation. What is your difficulty to grasp in that?"
e4ywwzq;BudDePo;1535486381.0;"They don’t expire in 2020. I think you mean 2025"
e4xwzil;_3li_;1535436430.0;"Yup. Get a job loser, stop trying to take our money to pay for your illegal alien infestation. "
e4y04mp;_3li_;1535439575.0;"Against what index?"
e4xk965;mar3ware;1535425521.0;"The point is that this is seen as discouraging auto manufactures from moving production to Mexico due to higher labor cost.  "
e4z86lu;Herbivore4Life;1535498044.0;"The economy and stock market is booming? It’s very clear you don’t watch the news. "
e4xtlqe;praxtology;1535433292.0;"I'm not making any prediction, I'm saying that I want to wait for details before making any judgement. Please point to where I said the deal was bad or good and I'll edit my comment to remove it."
e4y40yh;tomorrowthesun;1535443618.0;"Ok, I get my misunderstanding then, you weren’t talking about a reactor.  You may want to edit your previous comment.Not that you asked but a thing can be small and significant.  It’s significant because it’s in the right direction but small because it’s not anything to prevent nuclear weapons.I really am open to a better opinion here but I’m just not seeing a reason yet."
e4yqr76;hedgefundaspirations;1535474645.0;"If you can't point to any evidence of nuclear reactors being dismantled you need to edit your original comment."
e4y3bgp;amp-is-watching-you;1535442884.0;"**Direct link**: https://www.washingtonpost.com/news/worldviews/wp/2018/07/23/north-korea-begins-dismantling-key-test-site-satellite-imagery-suggests/---^^I'm&#32;a&#32;bot&#32;-&#32;[Why?](https://np.reddit.com/user/amp-is-watching-you/comments/970p7j/why_did_i_build_this_bot/)&#32;-&#32;[Ignore&#32;me](https://np.reddit.com/message/compose/?to=amp-is-watching-you&subject=ignore&message=If%20you%20click%20%27send%27%20below%2C%20the%20following%20action%20will%20be%20taken%3A%0A%0A%2A%20The%20bot%20will%20ignore%20you%0A%0AYou%20will%20receive%20a%20confirmation%20in%20reply.)&#32;-&#32;[Source&#32;code](https://github.com/bvanrijn/aiwy)"
e4zcdrd;Praxis_Parazero;1535501689.0;"> Again, I said relations are better with NK than they’ve been in decadesExperts on the subject disagree."
DELETED;NoAuthor;-1;DELETED;
DELETED;NoAuthor;-1;DELETED;
e4xq93o;Vulnox;1535430497.0;"I said several times if it happens and IF it’s actually good for long term growth, that’s outstanding. My problem as I wrote and fail to see the struggle you have, is nothing is signed. This chain of comments kicked off asking where people were going to criticize trump on this great deal. There is no deal. There’s a potential verbal agreement the full details of which we don’t really know. Especially the final details after Canada talks conclude, and especially x2 after Congress gets done with it. Once again because I guess you didn’t read anything I said, IF this is finalized and it’s positive for growth, great, props to Trump. But it means exactly nothing right now. Me telling you I’m going to give you $10,000 doesn’t make me a great person. Giving you $10,000 would sure help though right?So what do you want in life, the possibility of maybe getting $10,000, or actually having $10,000?  It’s that simple."
e4xziqe;godhand1942;1535438966.0;"I'm not. I had no problem with your other posts until you basically told the person to go fuck off to personal finance when his points are valid for r/finance."
e4yxx5j;Vulnox;1535487707.0;"You are absolutely right. Not sure what was 2020 or if the date changed or I’m just flat mixing it up. 2025 is definitely “better” (still don’t agree with tax cuts without proper expense cuts), still temporary for non-corporate. Thanks for the correction. "
e4xxq8u;Zymyrgist;1535437174.0;"I'm not a Democrat my dude. "
e4y46cx;best_damn_milkshake;1535443771.0;"If you can’t see the bias in the statement “small but significant step” I don’t think you’re a very critical thinker...think about it logically. Your explanation isn’t accurate. A step in the right direction but not meaningful is not a significant step...it’s just a step in the right direction. The language being used is intentionally pointed. Would you like more examples of this?"
e4yyco6;best_damn_milkshake;1535488243.0;"They destroyed liquid engines and nuclear test siteshttps://www.npr.org/sections/parallels/2018/05/24/613465473/north-korea-demolishes-its-nuclear-test-site-in-a-huge-explosionSorry for a typo. But you’re being disingenuous. You know I meant they’re making progress (slowly) towards denuclearization "
e4zcxev;best_damn_milkshake;1535502155.0;"That’s just straight up not true. At all. Here’s an article from the independent (a fair and balanced news source) that states NK canceling a recent anti US rally is evidence of improved relations.https://www.google.com/amp/s/www.independent.co.uk/news/world/asia/north-korea-anti-us-rally-cancel-donald-trump-kim-jong-un-a8415461.html%3fampSpreading false news like that shows you’re literally rooting for a failed deal with NK. That makes you a disgusting human being :)"
e4xzg5e;Ferelar;1535438896.0;"You’re painting with a pretty wide brush. Obama wouldn’t have gotten that far; if he’d put out tweets like that about Kim being a “Little rocket man” he’d have been run out of office. But more to your point, you said “If Obama has gotten three prisoners freed without paying ransom”... as I just told you, he did. 10 of them, albeit across 8 years instead of the 2 we’ve had Trump in.Have you considered that Trump receives little credit for that meeting because it was *bad*? We got prisoners that we can reasonably expect we would’ve gotten anyway, got empty promises from a despotic dictator which are now proven to have been ignored, and then discarded the whole affair. In exchange, North Korea got a significant amount of legitimacy. Look up how badly Kim Jong-Un’s father and grandfather wanted a picture of them meeting with a US President. That was a MASSIVE win for NK, it’s hard to overstate it. But that doesn’t mean I automatically assume Trump=bad. I was very much hopeful for the meeting. It just didn’t achieve any of the things it wanted. "
e4y9zej;CharlotteFigNewtons;1535449776.0;"You're both lame asf how bout dat"
e4xr5re;BimboDickins;1535431258.0;"Honestly you're all over the place. I quoted your comment saying I shouldn't say S&P shooting up is good because it doesn't automatically translate to a sustainable wealth and I agree with you on that point - but I wrote that in the context of the deal being great. Given the deal is great and the S&P shoots up, which is also great - what's your problem? Why should I not say the S&P shooting up is great given we have a great deal underlying that?I just felt like you built a strawman just to rebut me for some reason when I didn't say anything you should rebut"
e4xzr3v;BimboDickins;1535439198.0;"I didn’t tell him to fuck off - I reminded him this is investing. He had a point, but it was misplaced. I said S&P will shoot up given a good deal - he suggested S&P shooting up doesn’t necessarily translate to a higher economic situation for the average American - and he’s right - but it will translate to a better situation for certain investors - and given the sub what I said was perfectly fine and nothing he should rebut as ”having an issue with”.Given a great deal and a positive effect on the market - he should have no issue with that from an investor’s point of view. Of course it doesn’t necessarily translate to higher wages, whatnot, but this is /r/investing and not /r/personalfinance, and what’s positive for investors and what’s positive for the average American don’t always correlateIf he has a problem with that, as he said he did, he’s not in the right sub"
e507jcl;BudDePo;1535528736.0;"You make a good point about the temporary nature of the non corporate tax cut, that is a concern.  I also agree that there should be expense cuts.   Guess we’ll just have to wait and see."
e4y4p3o;tomorrowthesun;1535444311.0;"No after being insulted over pedantry I’m pretty much done.  The fact a step was taken is significant that’s a win.  It’s a small step because it means nothing in the greater scheme of things when they could buy an engine from Russia or China.I would hold out for a correction of your previous comment and examples of benchmarks being met."
e4zijcs;Biologyisfun;1535506915.0;"I’m pretty sure there was a famous guy that took a small step off of a ladder that was pretty significant. Lots of small things can be significant.“One small step for a man, a giant leap for mankind” or something like that."
e4yzcmv;hedgefundaspirations;1535489419.0;"It doesn't sound like you actually read the article you just posted...> But longtime watchers of North Korea's nuclear program say the closing of the site will have little impact on the nation's capabilities. "What does it actually mean in the long term? Probably not that much, unfortunately," says Melissa Hanham, a senior researcher with the Middlebury Institute of International Studies in Monterey, Calif. > North Korea has already conducted six nuclear tests at the site, the last of which was considered highly successful. Hanham says at this stage, it's not clear that North Korea needs to continue testing its weapons at Punggye-ri. By destroying it, "They're giving away the least useful part of their nuclear program," she says.You didn't make a typo, it was a massive overstatement of what's happened."
e4zjdtn;Praxis_Parazero;1535507614.0;"So they canceled a single rally while revving up their nuclear production even faster than before, lol. Mission Accomplished for the Fucking Moron! :)"
DELETED;NoAuthor;-1;DELETED;
e4ybzgp;Rookwood;1535451814.0;"Cash me ousside. "
e5081mv;Vulnox;1535529224.0;"Oh for sure, not much else to do. I’m hoping for the best for sure, but I’ve been on this ride before and I guess I’m hoping for the best,  but double preparing for the worst.  Stagnant wages, a rapidly rising housing market even in my home state of Michigan, crazy debt bubbles in multiple major markets including housing and new car sales... it’s just all very familiar."
