ID,User,DateCreated,Text
9aq6sm;Jogi_B3ar;1535414532.0;U.S., Mexico reach NAFTA deal; talks with Canada to start immediately
9aq6sm;Jogi_B3ar;1535414532.0;"[https://www.reuters.com/article/us-trade-nafta/mexico-u-s-nafta-agreement-close-but-item-still-pending-minister-idUSKCN1LC1E7](https://www.reuters.com/article/us-trade-nafta/mexico-u-s-nafta-agreement-close-but-item-still-pending-minister-idUSKCN1LC1E7)"

e4xl9oi;thewaterboy2;1535426386.0;"[Me walking into this thread looking for feedback on the deal](https://i.imgur.com/zGHQb4O.gif?2)"
e4xdz1e;ChipmunkDJE;1535420004.0;"Based on previous experience like North Korea, I'll believe it when it happens. Celebrating that we have "an understanding" when nothing is in ink is stupid. "
e4y08j9;truthdoctor;1535439684.0;"Title: U.S., Mexico reach NAFTA dealArticle: Deal close but items still pending. Mexico FM says deal is there even without Canada. President EPN says no deal without Canada.This whole thing is still up in the air and no one seems to be on the exact same page as to what will happen.>Trump threatened he still could put tariffs on Canadian-made cars if Canada did not join its neighbors and **warned he expected concessions on Canada’s dairy protections**.Canada already offered concessions but no deal was reached. Canada will not allow the [43 million gallons of tax payer subsidized milk US producers dump down the drain](https://www.wsj.com/articles/americas-dairy-farmers-dump-43-million-gallons-of-excess-milk-1476284353) to be dumped in the Canadian market.>The United States relented on its demand for an automatic expiration for the deal, known as a “sunset clause.”>Instead, the United States and Mexico agreed to a 16-year lifespan for the deal, with a review every six years that can extend the pact for 16 years, U.S. Trade Representative Lighthizer said.So sunset clause goes from 5 years to 16 years. [Canada won't agree to any sunset clause](https://globalnews.ca/video/4352269/canada-remains-strongly-opposed-to-sunset-clause-in-nafta-freeland).>Mexico agreed to eliminate dispute settlement panels for certain anti-dumping cases, a move that could complicate talks with Canada, which had insisted on the panels.Another sticking point.>“I think with Canada, frankly, the easiest we can do is to tariff their cars coming in. It’s a tremendous amount of money and it’s a very simple negotiation. It could end in one day and we take in a lot of money the following day,” Trump said.He still doesn't get it. Hit Canada with auto tariffs and the industry craters in both countries."
e4y33sf;chil943;1535442657.0;"So it'll be the same deal except with Trump's signature.... "
e4xv7w6;AmbivalentFanatic;1535434732.0;"Apparently none of this is actually happening the way Trump thinks it is. https://edition.cnn.com/2018/08/27/politics/trump-nafta-deal/index.html"
e4xu16d;repos39;1535433670.0;"This is a positive development considering trump has been getting hammered in news recently, and it a good look for Trump to reach some type of agreement with our allies. This could either be smoke to control news cycle, another NK, or it could actually lead to something. I love the gains I’m getting from this news, but I’m agnostic about the relevance"
e4ywucm;AmbivalentFanatic;1535486279.0;"Can anyone explain to me, in a rational, non-political, fact-based way, just why Trump claims NAFTA was the worst deal in American history? What is his basis for saying this, and how much of it is true? "
e4xc4mu;fisher571;1535418401.0;"Wait a second.. Reddits constant bashing of the Trump administration and the fear mongering that has resulted in a new trade deal with Mexico and prospects with Canada? Odd.."
e4x7x93;sneakschimera;1535414731.0;"Did trump just threaten car tariffs on Canada? Do we bring in a lot of Canadian cars I’m not aware of?edit: why do you guys hate me"
e4xw07j;Nonethewiserer;1535435442.0;"Nice job Trump"
e4x7x39;urriola35;1535414726.0;"Trump has Trudeau stuck up against the wall. Either he caves on the dairy management system  or gets hit with car tariffs that cripple Canada’s automotive sector and forces the high paying auto manufacturers to flee Canada."
e4xe1fr;ajgbaby;1535420063.0;"This hate against trump is still completely warranted. There was a risk (probably overcalculated by redditors) that the other countries wouldn’t comply and we wouldn’t reach a deal OR that he would piss off the wrong country and a few companies would be fucked over because of it. Was this a necessary risk? Depends who you ask. But if we progress our trade agreements and the US “wins” then Trump is still gonna try his best to fuck something else up before he leave office. Or maybe he’ll count his lucky stars he got away with the trade wars, possibly colluding, paying off a pornstar and he’ll just pardon all of his buddies and leave quietly. But there’s no way he’s done pushing his luck with other super-power countries. Not a chance. "
e4xrhex;prepper_of_doom;1535431511.0;"Best America is a Trump America."
e4xbxaq;BobLordOfTheCows;1535418221.0;"We need to take a page out of Trump's book and temporarily ban water and oil exports to the USA. Sorry but you guys are playing dirty, "ally"."
e4xapu9;fuzzywigg;1535417179.0;"I am willing to bet we see a WH comment about the ongoing spat between Saudi Arabia and Canada.  Something about women driving or their ownership of self driving markets, and why US needs to walk away from Canada."
e4xrezw;Devario;1535431457.0;"Really expected the John travolta meme"
e4xxtvh;Ferelar;1535437275.0;"I wanna see the details on the deal and the reaction of Canada before I start celebrating or even start giving feedback. "
e4xmgse;Jmc_da_boss;1535427378.0;"ya this thread needs to be burned to the ground"
e4xnvtz;BimboDickins;1535428553.0;"What are you talking about? This post has a lot of great discussions"
e4z3zig;bontre;1535494222.0;"Every fucking time Lol"
e4xiyc4;praxtology;1535424369.0;"Not too dissimilar from "funding secured" really. Let's see the details, on paper, and in front of Congress.Edit: Reading the rest of the thread, the lack of details on this has sunk any discussion of the deal to a Trump-favorability litmus test."
e4zn86m;rocky_whoof;1535510855.0;"The art of the deal."
e4xqzw1;NeverWasNorWillBe;1535431121.0;"Here I was thinking Trump made history by actually meeting with North Korea.  Guess I have low standards.  Maybe things take longer than a few fucking weeks.  Who would have thought?"
e4xsdjl;best_damn_milkshake;1535432237.0;"Well I think the markets know better than you, and judging by the Dow today....looks like the bull gods think this is gonna happen"
e4z1iqk;OttawaCharlie;1535491783.0;"Correct me if I’m wrong, but aren’t many of the cars imported from Canada, from American owned companies. They are just assembled in Canadian plants. Wouldn’t this punish American companies and consumers at the end of the day?"
e4yo2a5;CSI_Tech_Dept;1535468848.0;"Reminds me of the peace talks with NK."
e4y3y34;analyst_84;1535443535.0;"Is there a gym I can join to learn this level of mental gymnastics "
e4y98o7;uniqueguy263;1535449022.0;"That's a bunch of technicalities"
e4xyp73;godhand1942;1535438141.0;"Based on what the article posted, I see how Mexico benefits but I don't quite see how US benefits. Kinda feels like a good deal for Mexico (increase req NA %) but a meh deal for the US (increase min labor costs which is subjective at best).Can someone explain what benefits the US is getting that I'm not seeing?"
e4xm18r;theduke282;1535427017.0;"It's not a deal until it's signed.  Mexico has said no signing until Canada is on board."
e4xchal;yankee-white;1535418709.0;"In all honesty, it will probably nearly identical to NAFTA. This just allows both sides to take small changes back home and declare victory. Same will likely be true with Canada negotiating a separate deal with the US and one with Mexico."
e4xxc1w;elosoloco;1535436779.0;"Voter history quite clearly shows the talkative side of reddit is far smaller than you'd imagine, and one that has sociologically created a hive mind, as the result of vote manipulation, that's hard to steer. Just look at big threads that get nuked by mods on undelete. Also, just the other day a year old discovery of Iran manipulating Reddit resurfaced, on NBC of all places. Buried after mods found out for over a year."
DELETED;NoAuthor;-1;DELETED;
e4ywts7;porncrank;1535486257.0;"It's not a new trade deal It's some minor adjustments to NAFTA. I'm sure Trump will try to spin it as a huge victory when we could have just done this without all the theatrics. He even wants to change the name."
e4x828w;urriola35;1535414855.0;"Yes, GM, Honda, Fiat, Toyota, and Ford have huge plants in Canada. "
e4x8x6t;rebelde_sin_causa;1535415618.0;"A whole lot of car parts are manufactured in Canada and shipped to the US for assembly"
e4xopc0;AdmiralSeaDonkey;1535429241.0;"Im under the impression that Mexico will not formally sign until Canada is on board. If that's accurate, then wouldn't Canada be in a better negotiating position? "
e4xbo7t;TheGursh;1535418001.0;"The proposed auto tariffs would crumple the US auto sector. Removing our dairy management system would also put virtually all of our small dairy farms out of business. Folding to Trunp would create more issues than it solves. If it's not a win-win deal we will just keep negotiating."
e4xi4jj;FullAngerJacket;1535423545.0;"Then it sounds like we should be cautious towards Trump for now. I'll reserve my hate for when he actually fucks something up. "
e4xhd4m;unemployedITWorkerDB;1535422893.0;"Wow, you can tell the future.What are tomorrow's winning Fl Lotto numbers"
e4xfewn;pforsbergfan9;1535421236.0;"You mean someone who has more information then a random redditor just got lucky? Ok bud"
e4xjypz;Gustavus_Arthur;1535425263.0;"Lmao, the reason Trump freely shits on Canada is because he knows his threats are actually real. Canada has no leverage over the US bud."
e4xc6n1;recommendmeapodcast;1535418449.0;"huh? We've been in talks with canada since trump got into office. "
e4xdbie;vmerc;1535419443.0;"The numbers don't support your threats."
e4xhiua;jnf_goonie;1535423029.0;"LOL this is stupid."
e4xbupq;Excalibur457;1535418157.0;"What gives you this idea..?"
e4y6z4p;-jjjjjjjjjj-;1535446677.0;"I could be wrong, but I'm under the impression that these deals don't become public in their entirety. Obviously the parts affecting trade have to be since businesses have to know the rules, but I doubt the entire deal becomes public. I also don't see Congress voting this down in an election year when this was a central plank of an extremely popular (among his own party) President's campaign."
e4xzyv1;thisistheguyinthepic;1535439414.0;"I've been finding a lot of parallels between Trump and Elon Musk lately."
e4xsa7w;best_damn_milkshake;1535432161.0;"....they held a joint press conference"
e4xrgmq;ChipmunkDJE;1535431493.0;"> Here I was thinking Trump made historyYeah, made history by legitimizing NK's government for nothing in return outside a few dog tags. The Republicans screamed for 8 years that if Obama did that, it would totally undermine US foreign relations by recognizing a dictator. But when Trump does it, and actually lies about the results, it's a good thing?"
e4xyb08;RVA2DC;1535437745.0;"I know he made history by saluting a North Korean general. "
e4y3ml8;nezlok;1535443207.0;"Yeah.  The markets.  That’s who we should look to for measured, non-short term gain focused understanding "
e4zhjnj;truthdoctor;1535506082.0;"Yes. American (GM and Ford), Japanese (Honda and Toyota), and European (Fiat owns Dodge, Chrysler, Jeep and Ram) car makers have large plants in Ontario, Canada. These vehicles would become more expensive for the consumer to purchase. Many of the auto parts used in all vehicles in North America also come from Canada. Almost all vehicles would increase in price, which would decrease sales and lead to layoffs on both sides of the border."
e4y5d8v;CorporateGangster;1535444999.0;"75% of autos made in NAFTA countries and wage requirements looked like the big ones to me."
e4yz22h;B1naryB0t;1535489085.0;"I don't have time for many of the details or anything but it's worth noting that if Trump wants his trade war with China you need a trade alliance like NAFTA to have trade power. It was extremely dumb to start a trade war after pulling out of trade deals with our allies because then we didn't have nearly as much power to negotiate."
e4xo3du;BimboDickins;1535428730.0;"I agree with you, but christ man why aren't you optimistic? President of Mexico and Trump are on the same page. If Trump does a great deal with Canada too, S&P's going through the roof.Why on earth aren't you excited for what can be in North America? We're a deal away from an amazing economic deal between Mexico, Canada and the USA. And that's not some NAFTA CAFTA that pissed off an entire generation in the USA"
e4xne1e;JohnnyMnemo;1535428147.0;"Also needs to be passed by Congress, and there's significant opposition. so."
e4xd2ca;farlack;1535419225.0;"It seems like there is going to be a set rule. Mexican manufacturers make about $17 a day, this new rule will have 50% of the workforce in the auto industry make $16 an hour. I’m curious what the play is here."
e4xcye8;Draymondgreenyup;1535419130.0;"Not true ar all. 75% of all autos made in North America vs the current 62.5% should GREATLY boost the entire continent, especially USA AND the increase in $16 wage percentage of parts should create a lot more jobs in US. Not much else is known so far but it’s looking really good for everyone. The above alone could add at least $100s of billions over a decade in just increase in auto industry in America. The reason why this is taking so long is the deal is significantly different than NAFTA original and structurally as well though I highly doubt they can pull off the structural parts."
e4xdeum;mar3ware;1535419521.0;"Get off r/politics this is not nearly identical to NAFTA"
e4xlvxl;fratstache;1535426893.0;"Spooky "
e4x8gps;sneakschimera;1535415213.0;"Huh, TIL. Apparently they’re the 9th largest"
e4xr8le;Azules023;1535431318.0;"Canadian wages are fairly close to American. Isn't that the exact outcome that Americans want with manufacturing in Mexico? Why there an issue with Canada? "
e4xdyld;urriola35;1535419993.0;"The pain would force the auto makers to flee. That’s my whole point. I’m not saying US autos won’t be unharmed."
e4xm3bm;theduke282;1535427067.0;"We don't have many "small dairy farms.""
e4xy7n0;ajgbaby;1535437651.0;"4,8,15,16,23,42Also I’m just saying that you know he’s gonna stir up trouble, it’s literally one thing after another with him, trade wars, Iran embargo, North Korea talks. "
e4xmrl5;falco_iii;1535427630.0;"LOL.  40% of USA's oil imports come from Canada.  If Canada stopped or heavily taxed oil going to the USA, the USA would be FUCKED.  https://www.eia.gov/tools/faqs/faq.php?id=727&t=6  "
e4zkhfw;fuzzywigg;1535508543.0;"https://ipolitics.ca/2018/08/12/could-the-saudi-snit-be-a-squeeze-play-on-trudeau-to-benefit-trump-and-nafta/"
DELETED;NoAuthor;-1;DELETED;
e4zjr0j;fuzzywigg;1535507915.0;"Crystal orb told you so"
e4yd5kn;praxtology;1535453116.0;"They become public once out of negotiation, which would be when Congress votes on it. See NAFTA or even recently the much more sensitive Iran Deal."
DELETED;NoAuthor;-1;DELETED;
e4xsf5m;praxtology;1535432274.0;"Didn't they also do that with North Korea? I'm saying that a deal can't be judged until it is written, formally, and in front of people."
e4xurtx;Xx360StalinScopedxX;1535434325.0;"You know North Korea has had and continues to have embassies in some of the most influential western nations (Germany, Italy, UK, Switzerland) but that kind of gets in the way of framing Trump as legitimizing North Korea which is a terrible thing to do when Trump does but not when the other leaders of the west do ?"
e4xx64d;elosoloco;1535436613.0;"I mean, not directly communicating with a problem country that your Ally has had a cease fire with for decades, doesn't buy you much.  And esp after the country has launch icbms over yet another friendly country"
DELETED;NoAuthor;-1;DELETED;
e4y2l47;VPride1995;1535442112.0;"You’re just as bad as the people claiming victory. We all need to wait a year or three before concluding that Trump was right or wrong."
e4z0eml;NeverWasNorWillBe;1535490591.0;"No, maybe you're too young to know anything, but no that's obviously not what I mean."
e4y3tj3;best_damn_milkshake;1535443406.0;"The markets correctly predicted the long term growth of England over the EU the day after Brexit. (EU index fell way lower than UK). So yeah I trust the markets. It’s usually a good indicator for the global concensus. I know you’re being sarcastic but you sound like one of those bone heads who sold off his whole portfolio the day after trump was elected "
e4y8kq8;InvestorKen;1535448331.0;"As opposed to vehemently anti-Trump redditors?"
e4yo9pm;Neurorational;1535469261.0;"> The deal would require 75 percent of auto content to be made in the NAFTA region, up from the current level of 62.5 percent [...] That requirement could shift some auto parts manufacturing to Mexico from China, a White House official told Reuters, speaking on condition of anonymity. So that benefit may go to Mexico and not necessarily the US.The wage hike in Mexico could be good for Mexico workers, the Mexican economy, and US workers, although that probably could have been negotiated without all the bloviation."
e4xp11a;Vulnox;1535429497.0;"If it is a great deal, and not just people saying it will be because the White House says it will be, then major props to Trump and his team. It doesn’t erase all the terrible things he has done and will do, but I will gladly give him credit if he pulls it off. I said the same thing with the North Korea deal, which seemed promising and had all this pomp, yet is currently going nowhere. Or the big tax deal, which was advertised as being amazing for the middle class, but has been nothing but a tax breaks for corporations with no wide ranging positive impact for the middle class and a recent announcement of an awful government deficit because they had no good way to pay for it. Results are all that matter, positive or negative. If they get this done and it actually helps the average American that’s great. But you saying the S&P could take off, that’s the kind of crap that annoys the hell out of me. It’s like people that think the DOW is an indication of economic health.  99% of Americans don’t make their living based on how the S&P does, and it blowing through the roof isn’t helping me really. My 401K May improve, but even with that I need long term growth and improvement. If it’s a short term bump but has underlying issues that make problems down the road, it’s not helpful. Anyway, we will see. I seriously dislike Trump for a mountain of reasons. But I’ve said from the start that my dislike doesn’t mean I want him to fail. Obama, Bush, Trump, wanting any of them to fail is stupid since the failure of our government only hurts us. I hope Trump knocks it our of the park. But his track record so far is god awful and nothing is in ink. "
e4xolaf;the_narf;1535429148.0;"What part of that call made you think EPN and Trump are on the same page? EPN kept repeating that Mexico won't do a deal unless Canada in onboard. Trump just bashed Canada and then said 'We have a deal!'. Nothing got done, a new trade deal would need to get through Congress (won't happen before the primaries) and EPN is leaving office at the end of November to a political rival who repeatedly called EPN out on being too soft on Trump.This is just the North Korea charade all over again."
e4xv5rh;BTurnerwasmybitchAMA;1535434678.0;"Isn't Pena Nieto leaving in December though? "
e4ylxsf;MBP228;1535464877.0;"The current president of Mexico and Trump are on the same page, but he leaves office in a few months. That's where things get sketchy, as that date was driving the 90 notification deadline to Congress."
e4xom64;Zymyrgist;1535429168.0;"What does this actually do for the average American? S&P means nothing for the average American. Manufacturing/factory jobs aren't going to be magically revived. Automation has killed too much of that - why hire 1,000 Americans when I can build an assembly line and only hire 100 technicians from overseas?  &#x200B;The President of Mexico and Trump are NOT on the same page. Trump continues to spout this as a 'bilateral' deal between US and Mexico while his administration itself is still negotiating with Mexico AND Canada. He's totally out of touch with his own administration. "
e4xunuv;lshiyou;1535434227.0;"He's just stating fact. Let's get in writing and formalized before we celebrate. I'd rather be happy later than happy now and then dissapointed later. Cautious optimism is never a bad approach to take, and given this administration's track record, you can't be cautious enough."
e4xqfnh;Count_Rousillon;1535430651.0;"We don't know much about their talks.  But the little that has come out makes it sound much more like NAFTA 2.0: Rebranded with Minor Changes, than a major change in the nature of international commerce.  "
e4xecdw;miscsubs;1535420328.0;"That's great! So where do these extra $100s of billions and that $16 wages come from?Also does this agreement increase or reduce competition?"
DELETED;NoAuthor;-1;DELETED;
e4xhema;TheGursh;1535422929.0;"Flee to where and in what timeframe?"
e4xpxo3;TheGursh;1535430235.0;"Literally thousands"
e4y7pne;unemployedITWorkerDB;1535447437.0;"> 4,8,15,16,23,42 ThanksNKO talks were stirring up trouble now?I must have missed that news when the internet was destroyed by Net Neutrality "
e4xsgcp;Gustavus_Arthur;1535432302.0;"They still can’t do it. The consequences for doing that would be much more disastrous for Canada than whatever Canada can do to the USYou guys don’t have shit, which is why Trudeau (lmao) will cave in the next few days"
DELETED;NoAuthor;-1;DELETED;
e4ynhhm;jambajuic3;1535467722.0;"Or even TPP. "
e4xsthx;best_damn_milkshake;1535432612.0;"Since talks about meeting began we’ve had nuclear reactors dismantled, hostages returned, and various bench marks reached. Yes, talks are slowing down as they do from time to time (mostly because of Chinese saber rattling) but they’re moving in a positive direction...which is what the market was anticipating (not an overnight denuclearization). I’m sure you’ll reply with some snarky anti-trump comment, but if you actually believe NK relations are not better than they’ve been in decades you are in the minority opinion in America. This Mexico trade deal will most likely not be “inked” over night. Such an expectation would be unrealistic and not even the most energetic trump supporter would suggest that. However, like the NK deal, we are expecting trade relations with Mexico to improve, and if you actually follow actions instead of editorial, you will most likely see that improvement happen. This is a far different picture than we’ve been fed by the media, which said “Mexico will never make a deal with the US”. "
e4y0qj5;NotAnNSAOperative;1535440201.0;"No, its only terrible when Obama tried it.  Now that Trump is President, Fox news tells people its okay.  "
e4xxrr3;Ferelar;1535437217.0;"Of course not, and I'm glad they're home. However, I think that was less Trump and more part of a NK shift in priorities, seeing as how they've been releasing the prisoner backlog continually since 2012- these three were simply the last three remaining. "
e4y4l53;nezlok;1535444196.0;"On the contrary, both Obama and Trump have been great for me and I live in Europe.But trusting the immediate short term oscillation of the markets is retarded.   /r/wallstreetbets is no way to grow wealth son."
e4zkeeu;CorporateGangster;1535508469.0;"> The deal would require 75 percent of auto content to be made in the NAFTA region> So that benefit may go to Mexico and not necessarily the US.In isolation yes.  From the perspective of weakening China's export market, it is a win for the US.I think the wage hike is a net win for the region.  Bloviation, great word btw, is just how Trump operates. "
e4xpj9j;BimboDickins;1535429906.0;"Given you're in /r/investing, I suspect you're here to discuss investments? You're 100% correct - the Dow isn't an indicator of economic health. It's however great for investing, which is why I brought it up.You're in /r/investing, not /r/personalfinance. S&P shooting through the roof isn't bad for investing."
e4xuvoz;BudDePo;1535434422.0;"\>Or the big tax deal, which was advertised as being amazing for the middle class, but has been nothing but a tax breaks for corporations with no wide ranging positive impact for the middle class &#x200B;Middle class got a 4% tax break"
e4y5mvs;CorporateGangster;1535445277.0;"From the article: Mexican Foreign Minister Luis Videgaray told a news conference in Washington that if Canada and the United States do not reach an agreement on NAFTA, “we already know that there will still be a deal between Mexico and the United States.”"
e4xqa8w;anonFAFA1;1535430524.0;"Democrats will shoot themselves in the foot if there is a deal on the table and they refuse to sign before election day. They'll have to somehow convince the people it was a bad deal on the table."
e4y0ydy;NotAnNSAOperative;1535440427.0;"Yes"
e4xp91s;fisher571;1535429677.0;"Did you just say the s&p means nothing? If you have a retirement program, chances are they are invested into the s&p/dow so when the markets are doing well, so is your retirement. A broad statement like that makes no sense.​Also, they dont have to be on the same page. They just need to sign it. You seem to think that countries doing trade deals need to be happy 100% of the time with rainbows coming out their asses."
