ID,User,DateCreated,Text
992ufj;JMC266;1534884543.0;I'd Like My High Fives & Internet Points For Our "Creepy Hate Forum" Please.
992ufj;JMC266;1534884543.0;""

e4kgta2;WheresTheButterAt;1534885325.0;"Imagine being the guy who used to post and make fun of his hatemail and turning into this."
e4kgwep;BenadrylPeppers;1534885426.0;"Does he completely forget his hate mail section where for YEARS he posted peoples personal information and told his fans to harass them?The same section that is still up?"
e4kgo5y;Mr-Scurvy;1534885162.0;"Yep Maddox, you definitely didn't do a single thing to incite people over these past two years. Just been sitting there innocently minding your own business..."
e4kkkxn;hoodwink77;1534889219.0;"✋"
e4khoyp;DoYouKnowofMe;1534886318.0;"He always adds the word “encourage” to shit like this. NO ONES BEING ENCOURAGED TO DISLIKE YOU. Sorry, Maddox. You’re just highly unlikeable and it’s all directly because of your own actions. There’s no organized campaign against you."
e4ki475;MarcMoron;1534886762.0;"High-five, my buddy."
e4kjh07;Bojangles_Unchained;1534888142.0;"Well, gee, I was a Maddox fan and bought his books and stuff until I started frequenting all these creepy hate forums, which encouraged me via internet points to start thinking that Maddox is actually a really shitty person. I now see the error of my ways. High-fives: not even once."
e4kh8xa;MomentOfXen;1534885826.0;">forumsHey, Facebook is just a creepy deviant forum, this is the only hate forum you cock."
e4kkotw;Skrongman;1534889325.0;"Shout out to all of you guys, I hope you feel even more encouraged!"
e4kjzlt;BrassHockey;1534888642.0;"He sued a bunch of people and tried to get them fired!  It doesn't get more obsessed/hateful than that.     And his misinformation campaign and attempts to pretend the people who see through his BS don't exist only make them stronger.  "
e4ksu1u;chronus_poo;1534896366.0;"It's true. Dick and Asterios were associated with Maddox and they were harassed constantly for the last two years."
e4kgo8m;DoYouKnowofMe;1534885164.0;"This is great, but what did he say above that? "
e4ks4dc;Spork_Of_Doom;1534895766.0;"He literally sued everyone and their boss.How does he get to say shit like this without his fans just screaming at him?"
e4kuinu;Ctfc99;1534897779.0;"Shout out to JMC266, I hope you enjoy the internet point I gave you"
e4l3xzu;SpicyTonyPA;1534905614.0;"Shout out to OP for his fake internet points!"
e4lasmt;buffer_overfl0w;1534911386.0;"Maddox is a hypocrite. He's done aweful things to people. The reason why he won't mention it on his podcast or even acknowledge that he's sued people is because he wants people to see that he is the victim and everyone is out to get him. That's what Maddox is and the same goes for a lot of these YouTube personalities. They can't see anything wrong in their actions, they believe they are the victims. It's like Mundane Matt, typical example of a little narcissist. He's always like "me... me... me... I'm going to be a dad and I'm scared". What about his wife? Does she not matter or his wife's kid? Hypocrisy runs deep in the kingdom of soy. "
e4lf0ja;tefloncondom;1534914900.0;"✋"
e4m0vk1;biobb36;1534936103.0;">obsessedOpie was going on about how Jim Norton and Anthony Cumia are obsessed with him and can't stop talking about him. I think it was Jim who said something like "we're not obsessed with you Opie, you're just a lot of fun to make fun of""
e4kk9qv;DoodSalamander;1534888914.0;"Not sure how anyone can continue to be fans of someone who believes they’ve made decisions on who to like based on some fucked Pavlovian model. Fuck you maddox. I don’t need treats from Dick to know he’s better than you at everything."
e4ks4dy;hery41;1534895766.0;"Yo put me in the ~~screenshot~~ shoutout."
e4kt68g;Workamania;1534896662.0;"This is absolutely my favorite Maddox quote."
e4ktlpz;BadMrFrostySC;1534897026.0;"r/https://labbunny.com/wp-content/uploads/2015/01/acquitted-gif.gif"
e4lp9rn;SnakeJerusalem;1534924489.0;"Maddox, you dumb motherfucker. Lets assume, *arguendo*, you are correct about is (which you are not). Then why the flying fuck would you keep talking and spreading bullshit to anyone willing to talk to you? Don't you see that by doing that you only keep feeding our hate-forum?  How stupid do you have to be?"
e4o3f9s;Mastrrbasser;1535017070.0;"When I describe this whole podcast thing to friends I describe it like this:There was a podcast with 2 characters: Dick Masterson who was the loathsome alter-ego of Dax. And George, who was the loathsome alter-ego of Maddox.  "
e4ki9pn;BobJWHenderson;1534886927.0;"It’s not even the same person anymore. There’s late 90’s/internet 1.0 Maddox and there’s the 21st Century Cuck Maddox. "
e4lncg0;Spacemangspiff;1534922559.0;"Imagine being the guy who derides dicks call outs and screenshots, while simultaneously creating said screenshot and shout out? I need more mushrooms for this "
e4kh5j8;Grand_Admiral_C;1534885717.0;"Oh, you mean the section that I just checked to confirm is still up with email addresses still listed? Yep. Someone should tell Dr. Nurse that"Big M" is doxing people. She seems to have a very strong, principled stance against that kind of thing. "
e4kkq57;SithisTheDreadFather;1534889360.0;""It's different when I do it.""
e4l5emz;GADBabaganoosh;1534906824.0;"Remember when he [doxxed a kid on the I Am Better Than Your Kids website for his book?](http://www.iambetterthanyourkids.com/?u=top) He criticized the kid who told maddox he doesnt know comedy so maddox posted every detail of the kid, bunch of pics from presumably facebook. Sounds like a targetted harassment campaign.>On privacy: everything posted here is available publically on Tomek's own accounts that he has chosen to share. Some of my readers think this is carte blanche to start posting personal information such as his phone number, school, address, etc. It is not. Also, all use of his public images here are used for the purposes of commentary or criticism, and are fair use. Don't go posting his private information everywhere. He's a careless idiot, don't be one too.HMMMMMMMMMMMMMMMMMMMMMGUYS HIS SHITS PUBLICLY AVAILABE BUT DON'T HARASS HIM!  YOU DEFINITELY WOULDN'T IF I NEVER POSTED THIS PETTY SHIT ABOUT A GUY I COULD HAVE IGNORED!"
e4krei8;Rhalgarax;1534895183.0;"Null from Kiwifarms linked that as a response to Dicks tweet. Pretty funny to see side by side. "
e4kmczz;RealMildlyPoisonous;1534890878.0;"👏"
e4ki84k;FireballWhiskey26;1534886879.0;"Rewarded with shout outs!!!!"
e4kmaeo;RealMildlyPoisonous;1534890812.0;"The only one encouraging hate and anger towards Maddox is Maddox."
e4kjzl1;Ashanmaril;1534888641.0;"Phew, that'll throw him off the Targeted Harassment Campaigns Against Maddox Official TDS Meetups that Dick has been hosting weekly for a little while longer!"
e4kkv96;SithisTheDreadFather;1534889494.0;"Well, Maddox continuously being a litigious, slandering, despicable moron has encouraged me to dislike him quite a lot."
e4lc3vn;mawppp;1534912473.0;"I forget exactly where it is in BPITU but there's a point where he says he's rarely called out on his hypocritical views, I.E. at least 60% of the content on this reddit. Yeah Maddox, you're the only person responsible for your situation lol. "
e4ngy4d;SputnikDX;1534996796.0;"What can be more encouraging than twenty million dollars?"
e4l32zw;Ashanmaril;1534904902.0;"Speaking of, my internet points check bounced, anyone else? If I don't get my points by the end of the month I'm going back to liking Maddox."
e4kqxm3;dubb5ack;1534894797.0;"Well thanks.  I'm feeling more hateful already.  "
e4kh4nf;JMC266;1534885689.0;"Someone saying they can't believe Maddox "shared this with the comments on it" it's courtesy of Kiwi Farms and Dicks Twitter."
e4l20f2;Kanzel_BA;1534904014.0;"An empty crowd makes no noise."
e4lw37p;Spacemangspiff;1534931282.0;"🤚"
e4m1iet;tefloncondom;1534936724.0;"So many parallels, Jesus. This is what happens when one guy rides the coattails of someone funnier than them, then gets knocked off."
e4kj9p3;WheresTheButterAt;1534887943.0;"Have we pinpointed the exact moment Maddox became a cuck yet?"
e4kuhse;BenadrylPeppers;1534897759.0;"I'm not even sure about that, honestly. He's clearly always been an unstable fuck."
e4l2eqk;EBP_ReviewThePS2;1534904343.0;"Naw its the same person, we just used to think that Maddox was a character and the person playing the character wasnt a petty pseudointellectual and was reasonable."
e4ki2ji;BenadrylPeppers;1534886712.0;""Rules for thee but not for me.""
e4kl328;BenadrylPeppers;1534889699.0;"Something something prejudice + power = ????"
e4kri9r;BenadrylPeppers;1534895269.0;"Someone should archive.is his shit before he pulls it down."
e4lv2s8;smohqe;1534930288.0;"include me in the next episode"
e4oel2r;DoYouKnowofMe;1535029915.0;"$380 million"
e4l3hp0;Family-Duty-Hodor;1534905238.0;"Sorry, here's an internet point"
e4l3osk;Ashanmaril;1534905402.0;"I have no fans but I must ree"
e4kkxsh;juiciusmaximus3;1534889562.0;"When he moved to LA."
e4lrdj1;magnetosgiantcock;1534926610.0;"The pepperoni article"
e4kjuzv;bigniq1;1534888518.0;"As soon as he brought in black income disparity "
e4kwloj;BobJWHenderson;1534899515.0;" But he at least used to be funny. "
e4l6gus;the_pasemi;1534907718.0;"[It gets crawled automatically.](https://web.archive.org/web/20180120193642/http://maddox.xmission.com/hatemail.cgi)"
e4nxtwz;MAGAmanBattleNetwork;1535011674.0;"Here are archive links to George "Maddox" Ouzounian's hate mail page on his website, The Best Page in the Universe, https://www.thebestpageintheuniverse.net http://maddox.xmission.comhttp://archive.fo/uVlW0http://archive.fo/V2x9ihttp://archive.fo/Hcgim"
e4l3jzh;Ashanmaril;1534905290.0;"Wtf I hate Maddox now"
e4lak9m;mawppp;1534911192.0;"His weird rant about that one ugly lady who blocked that one gay marriage being a bigot, specifically the part where he just repeats "She's a bigot". At that moment he realized he could replicate the endorphins from calling someone a racial slur without any of the social consequences."
e4kxkv5;BenadrylPeppers;1534900327.0;"Oh for sure, but the illusion of mystique died a long time ago."
e4l6iba;BenadrylPeppers;1534907753.0;"This is beautiful, I have some digging to do. Thanks."
e4lfjaw;the_pasemi;1534915350.0;"I've never heard of archive.org taking down a backup unless it was for legit copyright reasons, but if someone throws a big enough tantrum they still might. The site is great but you can only trust it to a certain extent."
e4lgbv5;BenadrylPeppers;1534916028.0;"If CloudFlare would stop being a dick I'd add it to archive.is/.gd.I love that its fucking CGI."
