ID,User,DateCreated,Text
998g59;Spacemangspiff;1534924962.0;TDS Reddit writes a letter!
998g59;Spacemangspiff;1534924962.0;"Sup dildos and dildettes? With the recent shenanigans, it has been revealed that Maddox and co have been here more than normal looking for “evidence” or “dirt” or whateverthefuck they think they need. Since they’re here, and because Jaime stole my dope hit by insulting them funnier in another thread, I figured we should all write them a letter.  “Dear Madcast...”"

e4ls51l;TheChickOfDestiny;1534927367.0;"Dear Madcast,You're all less funny than me. And I am a girl."
e4lvd01;Grand_Admiral_C;1534930566.0;"Dear madcast,The guy who runs your network argued, in a legal document, that human beings are property. I'll walk you through it because, if the internet has taught me anything, people on the internet have trouble understanding law. Conversion is a property claim. You can think of it as the civil analogue of theft. He claimed his fans were converted. Legally, that's saying that people like me are roperty that he owned, and that Dick stole me in the way one might steal their neighbor's bike. That only works if we get rid of the amendments that did away with "humans can be property sometimes," and also if consumers of comedy aren't making their own decisions. Maybe ya'll should consider what that, combined with how he talks about his fans means about, means about what he actually thinks about you. Don't worry, I've got a sealed envelope with his real opinion inside.Love, Me"
e4lq3bt;SnakeJerusalem;1534925333.0;"We sincerely hope our discourse enrages and makes your blood boil to the point of throwing stuff at the screen..."
e4lq3ov;fhqwhgads7;1534925344.0;"Maddox lost."
e4lvgjr;Phteven_j;1534930662.0;"include me in the 2nd lawsuit"
e4lxsn2;portuguese-charlie;1534932968.0;"Dear Madcast,Welcome to our humble subreddit with 7,000+ subscribers. You’re free to look for rape lists as long as you want but unfortunately you will not find any. Of course, I’m sure I will not be able to convince you otherwise. Help yourself to some good ‘ol reddit gold with your dumbass posts in which you tell us how we are all delusional pyschopaths, we don’t mind, and above all, go fuck yourselves."
e4m1xrb;juiciusmaximus3;1534937160.0;"Dear Madcast,Please stay a supreme cuck and faggot because you've provided far more laughs this way than when you actually try to be funny and entertaining.Regards,A former fan"
e4m5s4u;killadonuts;1534941636.0;"Fuck Maddox"
e4lq2e5;Trenny_jr;1534925307.0;"No"
e4lukfi;Basherballgod;1534929780.0;"And always place second. "
e4lyi4y;Spacemangspiff;1534933672.0;"Yes madcast.  I’m sure I’m not alone amongst the other roasters here when I say I felt left out of the lawsuit just because you only really used posts from Twitter :( Consider us next time!"
e4lqv4r;Spacemangspiff;1534926097.0;"You’ve hurt me "
e4mvsr9;BenadrylPeppers;1534979612.0;"Well, Dick *is* the winner."
