ID,User,DateCreated,Text
99g8f2;brotality_;1534994146.0;Shocking new chat leak from Rucka! Maddox isn't really Armenian! (Not fake)
99g8f2;brotality_;1534994146.0;""

e4nndtb;yeahRIP;1535002177.0;"He's Armenian like the bodies in Cenk Uygur's basement are Armenian."
e4nlj9e;lago-m-orph;1535000607.0;"change “look white like him” to “look like arabic jews like him”"
e4ngrjp;MaybeIAmAFuckinIdiot;1534996645.0;"This is gonna ruin his personal and professional reputation."
e4nk9ie;stoney_bolognas;1534999539.0;"I actually love pita pit. Best stoner food besides taco bell"
e4oai25;brotality_;1535024704.0;"Big foul my dude. You can’t say that."
e4nwebn;ChaosCowboy;1535010303.0;"He's Armenian like Cenk's token co-host is Armenian."
e4pf7iq;tehpikey;1535075623.0;"there was one near me growing up that would give you pita pit branded rolling papers. "
e4o59mf;goathumper1;1535018911.0;"No one likes you. Get raped."
e4o65lj;ChaosCowboy;1535019930.0;"I live a rich and vibrant personal life, as beloved head of household of a wonderful family, and have an abundance of close friendships. Everyone I meet loves me. Like I give a shit about what gay-ass reddit commenters think. Blocked for obsessing about me. Get a life you weirdo. enjoy reading my posts going forward, freak.EDIT: downvoted"
e4obqxv;EatARape;1535026191.0;"How do people fall for this shit"
e4of7nu;Spacemangspiff;1535030810.0;"Beloved lolIncoming divorce "
e4ofeer;tumeke4u;1535031082.0;"Are you larping?"
e4ooydk;ChaosCowboy;1535049344.0;"I have no idea, but they line up to post on my shit and pile on replies on my threads that they know I'll never see. Clearly they care."
