ID,User,DateCreated,Text
99ws3d;countjulian;1535140639.0;Current State of r/Maddox
99ws3d;countjulian;1535140639.0;""

e4r02th;SnakeJerusalem;1535143504.0;"I am not sure what is sadder: that his reddit has come to this, or that he doesn't even care to clean it up."
e4qzm8i;Tomorrows_Nobody;1535142953.0;"Looks like Maddox's porn history"
e4r123k;BlueKnightBrownHorse;1535144627.0;"Is this guy going to kill himself?I hope he just apologies and focuses on moving forward."
e4r4794;DM_Of_The_Sea;1535147936.0;"This needs a NSFW tag.Also, link his subreddit on cuckold forums"
e4qz49m;MartialAutist;1535142342.0;"Judging by that username, I’d say it could be any of his followers. "
e4r364b;14_f_cali_pix;1535146919.0;"Cuck porn for a cuck subreddit."
e4rbdfv;sois;1535154215.0;"haha"
e4qy9ux;Lpup;1535141247.0;"this is amazing"
e4r213a;the_pasemi;1535145682.0;"I'm glad the bred meme caught on."
e4rc06h;cancegraf;1535154745.0;"Lmao why would he clean it up? He's likely jerking off to it as we speak."
e4rpod5;ozzie_ozzie;1535166236.0;"Weird. 7 hrs and no activity. Can I say 8/24/18 is called?"
e4rzj3c;sweetb00bs;1535174964.0;"What's saddest is that op was doing this for days trying to get noticed, so he made this post. Pathetic."
e4r22uw;SnakeJerusalem;1535145733.0;"He will only kill himself if/when he finally cannot afford LA anymore and has no other choice but to either get a job and/or go back to Utah. Killing his lifestyle of playing Dark Souls all day is the only thing that *might* make him realize the joke he has become."
e4rr6x9;Arcticfox04;1535167545.0;"He's going to go back to Utah and become a Mormon"
e4s65fs;avnavar;1535181538.0;"Or Tito's wife"
e4r37ci;countjulian;1535146954.0;"Why did you vote down some of my cuck vids"
e4qyb97;countjulian;1535141301.0;"I just tweeted at Maddox with this saying I am a confused fan and wondering if he's into cuckoldry now"
e4r0h59;Grand_Admiral_C;1535143968.0;"Obligatory ban lpup comment. "
e4s0db8;14_f_cali_pix;1535175749.0;"You should double check that one..."
e4r2n0v;countjulian;1535146329.0;"You'd think losing his hot model girlfriend would have done it"
e4r3gdr;14_f_cali_pix;1535147206.0;"Wasn't me. I upvoted all of yours."
e4r0hqt;Grand_Admiral_C;1535143988.0;"You know there's nothing inherently wrong with being a cuckold. "
e4rzkzx;sweetb00bs;1535175013.0;"This is pathetic"
e4sl54x;mothalick;1535198034.0;"Blocked"
e4qzisr;Xipotec;1535142837.0;"dude just leave him alone. he knows hes an idiot. we all know."
e4s1pna;countjulian;1535177081.0;"I'm the OP I've now posted some too but cali_pix was the one who's been doing it and all of the posts in the screenshot are his, try reading next time cuckboy "
e4r2zgd;SnakeJerusalem;1535146727.0;"We all know Maddox's true love is dark souls, second only to himself."
e4r3j3x;countjulian;1535147282.0;"Someone downvoted the vids of black men being cucked by white guys which I added in the name of racial diversity "
e4r0paj;countjulian;1535144227.0;"Yes, yes there is, listen to the Dick show to see why that's wrong "
e4s0fnj;countjulian;1535175815.0;"What a fucking cuck right"
e4sprwy;countjulian;1535204727.0;"Hahahaha"
e4r2c3e;SnakeJerusalem;1535146001.0;"The only person who doesn't know he is an idiot is himself."
e4qzjl7;countjulian;1535142863.0;"No"
e4r7lhm;lie4karma;1535151019.0;"When he gets the sneaky greek his job back, and then pays back the tens of thousands of dollars he cost everyone he sued... then we will leave him alone. "
e4r8624;oedipism_for_one;1535151507.0;"From his actions I don’t think we can confirm that."
e4s548b;sweetb00bs;1535180481.0;"both accounts a few months old. hmmmm"
e4sc1t0;jibmob;1535187733.0;"He has moved on to Fortnite"
e4raq3l;ozzie_ozzie;1535153682.0;"Jeebus, I go away to have a few beers with my mates and come back to this? Maddox should sue the NAACP next for not enough cuck diversity."
e4r916y;Cry_Havoc1228;1535152250.0;"There is NOTHING inherently wrong with being a cuckold. Check out The Dick Show to find out why."
e4su6v0;mothalick;1535213403.0;"hehe"
e4reanm;Anonymous____D;1535156685.0;"Well, point, counter-point"
e4rqful;mrnobano;1535166893.0;"Hehe"
e4rkqtu;kaizervonmaanen;1535162022.0;"I accept nothing less"
e4tg228;Xipotec;1535245318.0;"yeah ok. But the thing is he didn't do that to you."
e4sr2la;JAUNNNTY;1535207005.0;"Keep pulling the thread like a good detective"
e4sc6mi;SnakeJerusalem;1535187880.0;"That is just a vapid affair, he will soon get back to his long term relationship."
e4s1mk0;countjulian;1535176998.0;"I'd rather die than be a CUCK like Madcucks "
