ID,User,DateCreated,Text
9ayamj;MomentOfXen;1535486511.0;Episode 117 - Dick on Memory Rot
9ayamj;MomentOfXen;1535486511.0;""

e4yx1qo;MomentOfXen;1535486562.0;"[Libsyn Link](http://thedickshow.libsyn.com)"
e4z0ah5;elvoggo;1535490469.0;"What is it with edgelords coming on trying to be shock-jocks, talking about how their rattling everyone up. Then as soon as their shitty jokes don't fly the thin vinear of confidence fades away so quickly and they're suddenly saying "no one likes me in the group" "sorry if I came off weird" "this is my first time" "I'm not actually like that""
e4zat1d;mumkeyjones;1535500329.0;"Wow for once I wasn't the worst caller of the episode "
e4zakqg;grimster;1535500133.0;"That call was a fucking abortion."
e4z9pk6;-HOPHUNTER;1535499381.0;"that rape joke guy was so fuckin cringe, made bland tryhard jokes that didn’t land then didn’t even have the nuts to commit to them. his entire video was just a straight up rip off of sam hyde’s style without any of the nuance or subtlety that makes Sam funny. i can’t imagine how lame and cringe his “fans” are "
e4zhmj2;Nirvana2081;1535506149.0;"That Facebook guy was the worst.   Probably worse than Clegg.  "
e4zg6k4;FireballWhiskey26;1535504883.0;"Worst call-in ever"
e4zdkwq;callofthedeep;1535502697.0;"Wew, Fucking edgiboi. This prick is a foregone conclusion, you just know he has 'ICP' carved into his forearm. I hope the meth fucking kills you, you fatherless cunt."
e4z68ah;xxotaruxx;1535496302.0;""your group hates me though"Man that guy was fucking awful. And yes, he came off as a weirdo. "
e4zlz3p;Cathinswi;1535509806.0;"More Asterios bits and fewer edgelords for fuck sake. "
e4zmas5;Teddybearsyrup;1535510077.0;"can we never have a fan call in ever again?"
e4zc0yq;backwards7ven;1535501382.0;"So the entire show felt like a lucid dream that you can't wake up from. There's a parallel universe where tennis pro Dick rages at umpires on the centre court at Wimbledon until the Queen orders club officials to subdue him with ball cannons, before wrapping him up in one of the nets.I would pass off the Mumkey Jones film as an acid flashback if I didn't have it cued-up on YouTube. If he can maintain the production values of the first 20 seconds for the full 23 minutes then it is going to be great.Was the Rape Joker pretending to be an edgy teen trapped inside the body of an incel, or is he really a man whose peak fame will be a posthumous entry in the 24 hour news cycle, ending with the line: "before turning the gun on himself." For the record, I am good with either."
e4yyq42;BachelorHusband;1535488695.0;"The best part about the octave lower Spanish is when they dub someone's voice and it doesn't match at all. One of my friends was on the History Channel show Alone and he has a typical nasally Midwestern voice. They subbed the show into Spanish and suddenly this chubby Nebraska kid had a hilariously deep bass voice."
e4z3ut2;Mr-Scurvy;1535494101.0;"Well we got proof this week that Dick isn't really Mexican... He thought a normal roofing torch was a custom made flame thrower."
e4zi7fc;Warriordance;1535506640.0;"Dick says algebra is useless, then immediately uses algebra to explain it."
e4z9erm;with_strange_aeons;1535499120.0;"Dick speaks great Spanish"
e4z2s59;BobJWHenderson;1535493069.0;"Would have made more sense for Dick to have his dad on to make fun of Maddox saying he’s not Mexican enough. "
e4zuqk0;initialsdrummer;1535517163.0;"The fucking cucksockers part killed me. That is so funny.EDIT: Holy shit Clegg has some competition. Fuck's sake, this is bad.EDIT: It keeps getting worse holy shit. Why. The link doesn't work "ohh...it wasn't anything bad or anythingmmmrrrmrmmmm play this one wahhh....." *fuck* this guyEDIT: My bad, my voicemail was chopped up. Sean was right, I was supposed to sing a song to a girl in the purple dress but was told the girl was wearing a green dress. Don't ask your musician friend to help you propose via song. That song is forever ruined for me. I'll never forget that look from the green dress girl."
e5013ox;MattRuinsYourShit;1535522700.0;"I'm just here to make sure everyone is making fun of that rommel faggot. (nasaliest voice ever) "I'm so edgy and I think people not finding me funny are just easily trolled." Comes across like one of those guys that says stupid shit then when people say hey that's stupid he goes lol you got trickd I'm just pretendin."
e4z95yb;USDebtCrisis;1535498906.0;"Gab works fine without an app u/Lakembra back me up "
e4zb8zh;brobafett1980;1535500706.0;"Stupid sexy thumbnails."
e4zhocq;JackFroSTALKER;1535506190.0;"Is the "front hole" thing something people are actually saying or just some crazy rando? That doesn't sound like something a doctor would say. I get not wanting to make transpeople feel othered but they are biologically different and therefore need different treatment medically. "
e4zu86h;Feelinggood11;1535516737.0;"God dammit I had to stop and start later through that call like 4 times. What a fucking train wreck. "
e4yx9vv;pigsvomit;1535486867.0;"This episode will supply you with at least four hard chuckles and several soft ones. "
e4zudvg;MyroomRecords;1535516869.0;"Who was the Artist who had a falling out with /u/ [mumkeyjones](https://www.reddit.com/user/mumkeyjones) ? I don't remember that saga and am too lazy to search for more than 5 seconds."
e5014sz;AffirmativeNod;1535522729.0;"Dick. Please... I'd rather gargle a bouquet of cocks than having that edgelord call in again in the future."
e4z2dz0;MomentOfXen;1535492677.0;"So I've bandied this about randomly but I'm really convinced it would really help the education system out.So, high school is too easy and college is too bloated with unnecessary class. So why not take the "general" courses from college and move them down to the high school level? So that high school kids can take that astronomy or literature class, it'll be infinitely more interesting than "English 10" for them and hopefully actually challenge them so people like me can't graduate high school with a 3.7 after also getting written up for sleeping in class every day. So, with this change your college education takes two years, cutting tuition in half. So with another two for a masters and you now have a four year education that actually means something."
e4zlqi9;YashenTheVeganZombie;1535509607.0;"What is the Scottish band the drummer plays for? "
e4zttc4;TMacsLazyEye;1535516394.0;"~~Not your personal army~~"
e505iex;GADBabaganoosh;1535526815.0;""This is my first time on here"Hope its your last too I had to fast forward past that segment. Unfunny, annoying. Why. Why is that guy on?"
e505qhk;tumeke4u;1535527030.0;"To prevent another call like that, Sean should vet callers from now on.  Sean approved the pilot guy and that went pretty well."
e4z8313;chronus_poo;1535497954.0;"*(Bunch of high school students get shot)*That barely ever happens.*(Guy looses diabetes sponsorship because something his dad said two decades ago)*THIS WORLD IS FUCKED!!!"
e4z5uo1;ioNetrunner;1535495955.0;"Fun fact: Dick Masterson is also in the album thumbnail. Almost missed it myself. "
e4yy08n;sweetb00bs;1535487813.0;"Oops! That page can’t be found. atm"
e4z33nl;Trenny_jr;1535493379.0;"Like"
e4z4cet;i_thrive_on_apathy;1535494559.0;"Listening to that guy was actually painful."
e4z6sip;lolmonade;1535496808.0;"Oh, great.  Another internet try-hard who thinks that 2edgy5me attitude is all it takes to make a joke?I haven’t listened yet, but I hope it’s not as bad as you’re describing..."
e4zazj3;rahzark;1535500481.0;"His rage is SJWs and feminists. He has clout online. He's a troll for hire.You may call him T H E E D G E L O R D"
e4zbfqx;nicrules;1535500870.0;"Guys like that are why I think Web 2.0 is was a fucking mistake."
e4zfq3s;deegan258;1535504490.0;"You'll see that a fair bit at open mic nights and it's always wonderful watching reality hit those guys in the face. It was great how Dick and everyone else in that room was no-selling each of those shitty jokes."
e4zlbqg;ShawnGalt;1535509261.0;"the facebook group was a big mistake"
e4z3zq8;DingoDank;1535494228.0;"What a twerp that guy was, rape itself isn't funny, at least try to make a joke with it.  "
e4zfsc1;skinsfan55;1535504544.0;"Listening to that idiot literally made me want to book a trip to Greenland "
e4zglt3;Wubby211;1535505266.0;"Clegg v.2"
e4z6tb7;Constrict0r;1535496827.0;"I guess I'm just old and don't understand how hilarious rape dungeons are.  I think any topic can be made funny, but simply bringing up horrible things for the sake of it isn't terribly creative or funny."
e505gn3;tommy_twofeet;1535526768.0;"It's kind of like when the big cocky jock steals your girl but then you find out his dick don't work."
e509qot;BetterThanNot;1535530843.0;"Considering we spend an increasing amount of time interacting online, and everything associated with masculinity is slowly being shot down as "toxic," I could totally see guys like him becoming the modern equivalent of the 80s jock cliche."
e4zh9l0;PlutoIs_Not_APlanet;1535505840.0;"The question Sean asked about your name got a bit off in the weeds because it's different in the film. What actually is the origin of 'Mumkey'?"
e4zfvql;skinsfan55;1535504624.0;"Ha! Got him!"
e4zm5gq;MartialAutist;1535509954.0;"No, but it should have been. "
e4zzp50;sweetb00bs;1535521441.0;"Huhuh coomed. huh so funny"
e4zkzzf;asteist;1535508983.0;""You know Sam Hyde, I've emailed Sam Hyde... "I think that was the funniest thing he said."
e4zn5t5;smokecutter;1535510799.0;"I understand how shock humor works but the guy kept saying shit like "I'm I offending you" "Is this offensive" "Can I say this?", which is the equivalent of Jeb's "Please clap". How fucking insecure are you that you based your entire personality on being edgy and offensive but still have to ask every 3 minutes if your jokes are working."
e507g0g;derk662;1535528649.0;"Those kind of jokes work earnestly and or ironically. Earnestly where we are laughing at you i.e. the dumb redneck making racists jokes. Ironically where everyone is in on the irony i.e. a comedian/entertainer making racists jokes."
e508n9v;BloodFartTheQueefer;1535529798.0;"Clegg was retarded, but at least he wasn't an edgelord from what I remember"
e4znnp2;wowyeahlilboat;1535511212.0;"jeez"
e4z8pgg;Demplition;1535498503.0;"He crashed and burned toward the end. If he didn't start overtly worrying about coming off as a weirdo I would have just thought he was just drunk or high."
e501ojb;Midgetto;1535523242.0;"Yeah, I miss Asterios bits.  Not Asterios call-ins, not lists that Asterios emails to Dick, but prerecorded Asterios bits.  The delivery is always so much better in the prerecorded segments than when they try to do them live."
e4ztvrg;TMacsLazyEye;1535516450.0;"That dude was the worst I was so embarrassed to be listening to that shit Dick was on point though"
e4zjldu;HeWhoPours;1535507785.0;"random dude that found his way into the group and just posts random shitty videos of him smoking cigarettes. It's accurate that most people do not encourage him to post."
e4z4rw5;ThlnBillyBoy;1535494961.0;"There is a Portuguese VA for Kai from Beyblade, a 13 year old boy, who sounds like Christian Bale's batman. It's too jarring. The more emotional the scene gets the more hoarrrrrrrse his voice is."
e4zzgl4;smohqe;1535521229.0;"[this](https://youtu.be/oGw2WlpDMhg) is pretty good"
e502u8r;deegan258;1535524334.0;"Classic Dick vs. Dick"
e4zb8kt;brobafett1980;1535500696.0;""yo quiero Taco Bell" doesn't count"
e4z9o3s;USDebtCrisis;1535499347.0;"not really "
e4zzmlx;smohqe;1535521378.0;"timestamp for call end?"
e502nh3;chronus_poo;1535524158.0;"Shit, I wasn't. That you for the reminder. Fuck that pedo. More like the Desert Cocksucker."
e4zimdx;RobotOverlord328;1535506985.0;"Gab is trash. Turn on notifications. Turn on notifications. Porn bot. Anime posting loser. Wack job conspiracy theorist and all their followers. Above average female amateur political pundit (Just show us you're fucking tits), it's not having an app in the app store is the least of the problems."
e503ted;lakembra;1535525241.0;"Can confirm.  Also I deleted my gab account because gab is shit. Sorry m8."
e4zhtyk;MomentOfXen;1535506319.0;"From what I can tell it was literally a single article written by some website called Healthline written for transgender people. Just some good ol' fashioned outrage porn. Heathline then published a followup piece about how the world wasn't replacing vagina, it was used because the article was targeted for transgender people specifically. "
e4yxznz;sweetb00bs;1535487794.0;"itll also make you cringe until you cry"
e4zyxzg;madoffyousagoober;1535520772.0;"Maximum Panic"
e4z4fil;Gleeroy95;1535494639.0;"Sounds kinda like AP classes which have been around forever"
e4z7wc1;lolmonade;1535497791.0;"That’s more or less what the utility of community college is.  Getting an associates (2-year) degree is getting all of those gen ed classes out of the way at usually a much less expensive price than what you’d pay for a public or private university.  With some exceptions, all those credits are usually transferable to nearby public universities.I’m a parent of 2 boys, I consider it part of my responsibility to make sure their expectations for college life are leveled appropriately.  Stay at home for the first two years and get your associates, take that time to learn what you want to do for a career, make that career choice in your early 20s rather than making a boneheaded choice right out of high school that ends up costing you tens of thousands of dollars to learn from that mistake.I’m also not opposed to them taking a year off and just working between high school and college.  There was a lot of scare tactics when I was a teenager about how kids who take a gap year just end up not going to higher education. That 1) assumes that college is the only way when there are trade schools that can lead to lucrative careers, and 2) that it’s a good idea to send an 18 year old child to college on a mortgage’s worth of debt to figure it out.I have a good career and salary, but My brother makes about 20k more than me a year, being about 6 years older than me, and has 0 college debt, getting a certification in heating and air conditioning.  Maybe my tune will change if my salary doubles in the next 10 years of my career, but so far, I’d say he’s “winning”."
e4z5h95;Pestosterone;1535495610.0;"High schools don't have the necessary amount of competent teachers to start throwing in a bunch of weird, random classes. The quality would be abysmal and kids would end up hating the subjects. With the quality being so low there's no way they'd rightfully be qualified to participate in that field. It would come down to how the system already is. You pay for a good private education or you get a shitty public one."
e505099;smokecutter;1535526338.0;"System of a Haggis."
e4z9kv4;USDebtCrisis;1535499269.0;"Yes. Precicely. It barely ever happens. It's a statistical anomaly.You don't think that living in a world where your life can be destroyed by something someone in your family said before you were born is fucked? "
e4zveqs;_SenzuriChampion_;1535517738.0;"The only way you people have arguments is by taking the dumbest possible position and then pretend its what your opponents believe. Grow up."
e4zzzv0;sweetb00bs;1535521704.0;"Bitch were talking about front holes all up in this computer"
e4z0iam;MomentOfXen;1535490698.0;"SHAME THE NEWBIE*SHAME*"
e506aez;tumeke4u;1535527556.0;"Kill yourself!"
e4zfjp0;Workamania;1535504341.0;"That's what made it so satisfying. "
e4zbikn;ragadabah;1535500939.0;"It's worse"
e4zu472;Feelinggood11;1535516647.0;"It's fucking horrendous "
e4zfm4h;Workamania;1535504398.0;"Hollywood has decided the only time it's funny is when straight men are raped in prison by larger men. Sad!"
e4z5851;Teddybearsyrup;1535495378.0;"Have you ever been raped? Because until you have I don't think it's within your right to judge whether or not it's funny"
e4z7s83;elvoggo;1535497691.0;"It's definitely a type of person I've come across a bit. Mainly younger guys who don't know how to craft a joke and think the pure shock value of saying something taboo is what humour is. "
e4zjs5z;mumkeyjones;1535507941.0;"it's a mixture of Human and Monkey because my friends in high school wanted to let me know i look like a hybrid "
e505401;The_Atticus;1535526434.0;"99% of that call was cancer, but the "coom" thing was actually hilarious if only because of how stupid of a joke it is to slip in there, and how he kept doing it."
e4z7c6u;armoured_bobandi;1535497290.0;"> Beyblade>emotionalPick one"
e4zatwl;with_strange_aeons;1535500349.0;"Maybe great wasn't the right word, but he definitely speaks it better than I expected."
e4zzqcc;initialsdrummer;1535521471.0;"1:37:28-ish"
e4zjevu;USDebtCrisis;1535507638.0;"You aren't required to follow every user. Other than notifications everything else you mentioned is the same as twitter. I haven't had a notification request for a long time. Plus they actively take down bot accounts on gab whereas they are a feature of twitter."
e504ip8;USDebtCrisis;1535525885.0;"What the fuuuuuuuck "
e4zl041;JackFroSTALKER;1535508986.0;"Always hate when stuff like that gets blown out of proportion since there is more than enough legit shit to get outraged about. "
e4yz29p;pigsvomit;1535489092.0;"Are you referencing our dear first timer? I thought he did great for being his first time. It was his first time, after all! Pretty edgy for a first time caller!My favorite trainwreck call-in so far.​"
e4z4r6o;MomentOfXen;1535494943.0;"Yes make all things AP classes"
e4z8yos;SithisTheDreadFather;1535498728.0;"AP classes are a fucking scam. Practically no university actually gives a shit about them, and they don't apply if you don't score a 4 or 5 (which is a moving target because the grades are on a curve). Or, if they do apply, it's for classes not on your degree plan. Dual credit was where it was at, mainly because you took them at an actual community college. I was so lied to in high school about AP. "
e4z8bl0;MomentOfXen;1535498165.0;"Yep, I definitely wish I did my college career differently. Two years of high school, two years of CC, two years of undergrad, two years of grad should be the future. "
e4z5man;MomentOfXen;1535495738.0;">The quality would be abysmal and kids would end up hating the subjects.So it would be roughly the same quality?"
e4z9vu1;chronus_poo;1535499532.0;"> You don't think that living in a world where your life can be destroyed by something someone in your family said before you were born is fucked?But that barely ever happens. It's a statistical anomaly."
e4zlodb;Cathinswi;1535509557.0;"Losing a sponsorship is much more worse than being murdered. "
e502kn8;chronus_poo;1535524086.0;"I am not misrepresenting anyone. Many people (including me) say that school shootings are rare. Dick went off on a rant a while back about how school shootings are so rare they shouldn't count as news. What exactly do you think I'm trying to say "my opponents" believe?Here's the point of my original post. It's funny to think about what people consider harbingers of the end times and what they write off as being unimportant. For some people, the Parkland shooting signaled a crossroads where we had to choose between a civilized society and the wild West. For others, deplatforming and job lynch mobs are the sign a the crossroads. The strangest thing to me is that there's an apparent lack of crossover between the two groups. Why would deplatforming and school shootings be related in any way? I don't know the answer. That's what makes it funny to me."
e4ze6lh;Pestosterone;1535503200.0;"I'm a minute in and I don't think I can continue."
e4zt500;Mr-Scurvy;1535515821.0;"It was definitely worse than the lolicon guy..."
e4zvppk;lolmonade;1535517996.0;"Wow...you weren’t wrong.  They really let him keep hanging himself, didn’t they? "
e4zek9d;avnavar;1535503522.0;"I was raped by a clown. It got a fake lol out of me, 4/10"
e4zfjvy;deegan258;1535504346.0;"One time my uncle told me a work story that I had already heard twice before from him, so I feel like I'm a good judge on these scenarios."
e4zn0vj;PlutoIs_Not_APlanet;1535510684.0;"Hahaha that is the exact level of wordplay I remember being used to tease friends when I was in high school. "
e4z7rmd;ShaunWhiteIsMyTwin;1535497676.0;"Let it rip, my dude. "
e4z9fjn;ThlnBillyBoy;1535499139.0;"Now now don't be a bey-hater."
e4zr1fe;TMacsLazyEye;1535514052.0;"Dicks Spanish is as Spanish as this https://www.fluentu.com/blog/spanish/wp-content/uploads/sites/2/2015/02/Choosing-the-perfect-spanish-textbook-for-you1-212x300.jpg"
e4zztvi;smohqe;1535521556.0;"thanks.  haven't had a chance to listen yet, but i already know im skipping that shit"
e4znlqn;RobotOverlord328;1535511167.0;"It's the retweets that you see on gab. The last time I used every time I opened it, "Do you want to turn on notifications?" No, just like yesterday. The whole Twitter gab style social media is just stupid. You put up a post-it note and people respond or don't. Then people get into long form debates where they have to split a covent thought over 3 tweets. Worse when one person whites a 20+ tweet diatribe about whatever stupid thing they think is important. "
e4zxslv;apathetic_lemur;1535519782.0;"can you believe was this one guy on twitter who professes to eat his own shit said about Trump? All libtards are the same"
e4zhiti;PlutoIs_Not_APlanet;1535506063.0;"The only thing I love more than a burlap sack rape joke is the *same* burlap sack rape joke twice. 10/10 caller. "
e4z0eet;elvoggo;1535490586.0;"He was up there. But I don't think anything can ever top Adam Nash incl. the amount of asterios characters born out of it."
e4yzicy;Gleeroy95;1535489599.0;"Dude sounded like he was one more drink away from a mental breakdown, good stuff"
e4z4udp;Gleeroy95;1535495026.0;"That sounds like you actually want kids to excel and that's not what we're about in America"
e4zks6d;seabiscuity;1535508799.0;"Not enough competent teachers."
e4zb32y;The_Atticus;1535500566.0;"Someone's salty about scoring below a 4. Almost all colleges worth their salt accept AP credits. Even if they don't, taking ones similar to your major will help you when you take the corresponding college course.They're not a "scam" either. My friends took a few AP classes and it saved them a lot of time in pointless general education credits they make you take first year of college, or let them skip over beginner calculus courses and jump into the more complex stuff first year, which you can either leverage to graduate more quickly or have a lighter workload over the same 4 years."
e50983a;688as;1535530349.0;"AP was dope, let me skip Calc I & II, my English requirement, my first two computer science classes, and my science requirement. Saved me a ton of tuition money "
e4z9j3o;lolmonade;1535499226.0;"I’m in the same boat.  Hard to know better when you’re conditioned on how important it is to go straight into college as a teenager, and all the media and guidance councilors at the time was romanticizing college life, too.I’d caution anyone from getting a masters degree until they have some experience (unless it’s a field where you NEED one to have a career).  I just got my MBA last year, but it wouldn’t have benefitted me up to this point where I’m starting to get managerial experience.  "
e4zcgfh;Pestosterone;1535501754.0;"No, cause my math teachers taught math fine. My high school psychology teacher sure didn't cause he wasn't qualified. Same with almost every elective."
e4zb946;USDebtCrisis;1535500710.0;"Yes It's ok to live in a literal gulag as long as some crazy asshole doesn't go postalEat some more glue retard"
e4zbpgw;Morcock;1535501106.0;"They both might be statistical anomalies, but frivolous firings happen to celebrities, while shootings happen to nobodies. If I've learned anything from the e-celebrities I get my opinions from, they are much, much more important than other people. So a small percentage of people having career setbacks for unfair, idiotic, overly sensitive reasons  IS the end of the world, it's all fucked and the world is a gulag. They've whipped me into a frenzy, we have a battle to fight against PC culture, so shut up about all the murder!"
e50atdc;yeahRIP;1535531972.0;"From a certain point of view being murdered is the ultimate form of trolling someone. You got them so mad at you that they are going to spend a large chunk of their life in a jail cell because they killed you. "
e4z9ncg;armoured_bobandi;1535499329.0;"Please understand, I don't hate beys. Some of my best friends are bey-sexuals "
e4z50qp;MomentOfXen;1535495190.0;"(☞ﾟヮﾟ)☞"
e508zuj;688as;1535530133.0;"Too many incompetent teachers devaluing the field. "
e4zd7va;MomentOfXen;1535502398.0;"If you can't get a 4 on the AP Psych test, book a flight to Greenland."
e4zqe43;cblasfemia;1535513513.0;"I went into college with 8 or so AP classes that I scored a 4+ on and it didn't help because they only counted as generic credits and weren't acceptable as substitutes for Ged Ed classes, except for Calculus and Macroeconomics."
