ID,User,DateCreated,Text
e4zdlux;SithisTheDreadFather;1535502720.0;"Yes, they accept credits. But they don't always go to the degree plan you're looking for. So glad I got a 5 in APUSH only to learn that it meant nothing and I would've been better off just taking a PoliSci dual credit class so I didn't have to pay for one at university.Edit: same with nearly everything else I took: World History, didn't need; English 3, didn't count; English 4, well I probably should've scored higher than a 3 my senior year; Calculus, too advanced for my freshman year and worthless for my degree. And yeah, I could've scored a 5 to get out of Chemistry or Physics, but I didn't.The takeaway was that I could've had a much less stressful high school and still got better credits easier and that actually pertained to my degree plan. The best part about AP was not having to be in class with the slobbering morons that I experienced my senior year when I took regular Gov/Econ. Holy fucking shit."
e4zjkmv;The_RedWolf;1535507768.0;"Sithis is right though, it is complete bullshit.  Just sticking with a common one, US History.  Only about 55% get a 3 or higher, so you can spend all that time and effort in the class, do really well in it and still end up with nothing.  This is especially true if the university you go to requires a 4 or 5.Yeah good fact of life lesson there, but it's all bullshit when you can spend that time in a dual credit class which is undoubtedly easier and get guaranteed credit that transfers everywhere with a C.I'm so glad I took nearly a full year of credit in DC.  The only AP class I took was World History and that class didn't get me anything despite getting a 4."
e4zadqi;MomentOfXen;1535499965.0;""I want to be a lawyer""Do Pre-law courses!""Sounds right"And that's the story of how I have a useless political science degree instead of something like a science degree to allow me to get into a particular area of law or something else that is useful on its own. "
e4zcihc;MomentOfXen;1535501804.0;"To be fair the generals math classes in college are the same ones I took in high school anyway."
e4zo87v;chronus_poo;1535511686.0;"I don't pretend that either is okay."
e4zcqjy;USDebtCrisis;1535501995.0;"How many more times are you going to edit your post to shove more retarded strawmen into it? Just take them and shove them up your ass you dipshit"
e4zjs7y;The_RedWolf;1535507943.0;"In Texas, they passed a law that all public universities are required to give credit for 3 scores if they accept that test.  So many got around this requirement by using 4's for their major specific version and 3 for a general version.  Like in Calculus AB a 3 gets you business calculus, 4 gets you the normal one.  In Calculus BC you have to get a 4 to get a full year which is the whole damn point, or a 3 for 1 semester.In Biology and Chemistry, 3 gets you non-science major science credit and 4 gets you the science major credits"
e4zvvnm;USDebtCrisis;1535518136.0;"Nobody said either of them was ok. In the case of school shootings the only thing we disagree on is how to solve it."
e4zda37;Morcock;1535502448.0;">How many more times are you going to edit your post to shove more retarded strawmen into it? Just take them and shove them up your ass you dipshitSorry, second language, didn't got to school in the US. It sucks, because my sentences sometimes need revisions, but on the plus side, nobody ever shot at me at math class or a video game tournament. (I like that a lot.)One day, I'll be able to EPICALLY WRECK people with banter like "EAT SOME MORE GLUE RETARD" but till that day comes, I'll have to occasionally edit my posts, I hope you can live with it. I know I can. "
e501auh;chronus_poo;1535522884.0;"Then don't sarcastically imply that I think one of them is okay."
e502fgo;MomentOfXen;1535523953.0;"it's been too long since i mindlessly joined the weekly shout at you>the only thing we disagree on is how to solve it.what's your opinion "
e4zdh94;USDebtCrisis;1535502613.0;"Try making an actual argument:    ^           ) "
e503k2h;USDebtCrisis;1535525003.0;"https://www.youtube.com/watch?v=5oZi-wYarDs"
